<?xml version="1.0" encoding="UTF-8"?>
<stepRequestMapper xsi:schemaLocation="step.xsd">
    <multiScopedSteps>
        <step name="#">
            <scope request="#" nextStep="#"/>
            <scope request="#" nextStep="#"/>
        </step>
    </multiScopedSteps>
    <mappedRequest request="#" rootStep="#" applyGenericSteps="#" onSuccess="#" onFailure="#">
        <jumper forStep="#" conditionClass="#" onSuccessJumpTo="#" onFailureJumpTo="#"/>
        <breaker forStep="#" conditionClass="#"/>
        <repeater forStep="#" conditionClass="#" repeatFromStep="#"/>
        <pluginRequest name="#"/>
        <preSteps>
            <step>1</step>
            <step>2</step>
        </preSteps>
        <postSteps>
            <step>3</step>
        </postSteps>
    </mappedRequest>
    
    <mappedRequest request="#" rootStep="#" onSuccess="#" onFailure="#">
        <preSteps>
            <step>4</step>
            <step>5</step>
        </preSteps>
        <postSteps>
            <step>6</step>
            <step>7</step>
        </postSteps>
    </mappedRequest>
</stepRequestMapper>